Skjermkort 2;Dette er vårt nest billigste skjermkort;10;399.0;Skjermkort;./src/Datamaskin/images/missingImage.png
8GB RAM;Dette er vårt beste skjermkort;10;699.0;Minnekort;./src/Datamaskin/images/missingImage.png
256 GB SSD;Dette er et minnekort med rask lagring;7;999.0;Harddisk;./src/Datamaskin/images/missingImage.png
Intel Core I5;Nyere versjon av prosessor;5;499.0;Prosessor;./src/Datamaskin/images/missingImage.png
Strømforsyning 2;1.5 meter ledning;5;399.0;Strømforsyning;./src/Datamaskin/images/missingImage.png
Lydkort 2;Den beste lyden på markedet;7;799.0;Lydkort;./src/Datamaskin/images/missingImage.png
Optisk disk 2;Godt egnet for gaming;7;1429.0;Optisk disk;./src/Datamaskin/images/missingImage.png
Rød;En fin farge inspirert av rød rose;10;299.0;Farge;./src/Datamaskin/images/missingImage.png
